<?xml version="1.0" encoding="UTF-8"?>
<IntegrationPipes xmlns:xsi="http://www.w3.org/2001/XMLSchema-instance"
	xsi:noNamespaceSchemaLocation="integration-fwk-pipeline.xsd"
	xmlns:fwk="http://attunedlabs.com/internal/integration-fwk-Supporting">
	<IntegrationPipe name="SAC-SR" isEnabled="true">
		<PipeActivity>
			<XSLTEnricherActivity name="testxsltTransform1">
				<xsltpathMapper>
					<xsltPathMap filePath="testxslt.xsl" />
					<xsltPathMap filePath="testxslt2.xsl" />
				</xsltpathMapper>
			</XSLTEnricherActivity>
		</PipeActivity>
		<PipeActivity>
			<FTLEnricherActivity name="testftlTransform1">
				<ftlpathMapper>
					<ftlPathMap filePath="paymentNotificationTemplate1.ftl" />
					<ftlMapto toXpath="EmailNotification/Body"/>
				</ftlpathMapper>
				<ftlDataMapper>
					<ftlfieldMapper msgXpath="intermsg/invoice/template/recepientAmount"
						ftlField="recepientAmount" />
					<ftlfieldMapper msgXpath="intermsg/invoice/template/description"
						ftlField="description" />
				</ftlDataMapper>
			</FTLEnricherActivity>
		</PipeActivity>
		<PipeActivity>
		<FTLEnricherActivity name="testftlTransform1">
    <ftlpathMapper>
     <ftlPathMap filePath="ftlBodyTemplate.ftl" />
     <ftlMapto toXpath="EmailNotification/Body" />
    </ftlpathMapper>
    <ftlDataMapper>
     <ftlfieldMapper msgXpath="EmailNotification/Payload/Event/@ID"
      ftlField="serviceID" />
     <ftlfieldMapper msgXpath="EmailNotification/Payload/Event/SRNumber"
      ftlField="SRNumber" />
     <ftlfieldMapper msgXpath="EmailNotification/Payload/Event/SRLocation"
      ftlField="location" />
    </ftlDataMapper>
   </FTLEnricherActivity>
   </PipeActivity>
		<PipeActivity>
		<FilterPipelineActivity name="filterPipeLine">
			<conditions operator="AND">
				<condition expression="DATA2SC/CALL/@TYPE"  value="WoNew"/>
				<condition expression="DATA2SC/@ID"  value="WoNew"/>
			</conditions>
		<conditionSuccess>
          	<fwk:send value="true"/>
     	</conditionSuccess>
     	<conditionFaliure>
		   <fwk:drop value="true"/>
    	</conditionFaliure>
	</FilterPipelineActivity>
		</PipeActivity>
		 <PipeActivity>
			<EmailNotifyActivity name="testemailnotification">
					<EmailNotification recepientIdXpath="EmailNotification/Recipients/Recipient"
					mailSubjectXpath="EmailNotification/Subject" mailBodyXpath="EmailNotification/Body"/>
			</EmailNotifyActivity>
		</PipeActivity> 
		
		<PipeActivity>
			<FTLEnricherActivity name="testftlTransform1">
				<ftlpathMapper>
					<ftlPathMap filePath="paymentNotificationTemplate1.ftl" />
					<ftlMapto toXpath="EmailNotification/Body" />
				</ftlpathMapper>
				<ftlDataMapper>
					<ftlfieldMapper msgXpath="intermsg/invoice/template/recepientAmount"
						ftlField="recepientAmount" />
					<ftlfieldMapper msgXpath="intermsg/invoice/template/description"
						ftlField="description" />
				</ftlDataMapper>
			</FTLEnricherActivity>
		</PipeActivity>
	</IntegrationPipe>
</IntegrationPipes>